{
  "phase": "10",
  "status": "passed",
  "generated_by": "OpenAI Codex",
  "generated_at": "2026-08-06T00:00:00Z",
  "smoke_command": "python -m medfm.cli.peft inspect --model medsiglip_448 --format json",
  "smoke_passed": true,
  "criteria": [
    {"id": "P10-01", "description": "LoRA and quantization configuration are independent, versioned, canonical-hashable, and validate incompatible fields before injection.", "status": "passed", "evidence": "tests/phase_10/test_config_and_backend.py covers schema version, aliases, rank/alpha/dropout/bias/modules-to-save/RS-LoRA/DoRA, NF4/double-quant/BF16, and invalid configurations."},
    {"id": "P10-02", "description": "Backend policy distinguishes CUDA NF4 QLoRA from TPU BF16 LoRA and rejects unsupported combinations before allocation.", "status": "passed", "evidence": "CUDA/TPU matrix tests, typed capability errors, BF16 preparation metadata/dtype/cache checks, and the Phase 10 validator policy check."},
    {"id": "P10-03", "description": "Architecture-aware module inspection selects reviewed attention/MLP targets and fails closed on excluded, zero, unknown, or broad matches.", "status": "passed", "evidence": "tests/phase_10/test_resolver_and_injection.py verifies 2D exclusion rules, 3D late-stage restriction, explicit unknown confirmation, zero-target rejection, and broad-target rejection."},
    {"id": "P10-04", "description": "The PEFT inspection CLI emits module name, type, parameter shape/count, selected flag, reason, architecture, and selected count.", "status": "passed", "evidence": "CLI smoke resolves medsiglip_448 as vision with 12 selected modules; test_cli_and_validation.py validates JSON fields."},
    {"id": "P10-05", "description": "Visual and language LoRA injection supports named adapters with deterministic freezing, boundary/component trainability, and optimizer-visible groups.", "status": "passed", "evidence": "2D, 3D, and language injection tests audit requires_grad, adapter/bridge counts, gradients, named adapters, and optimizer groups."},
    {"id": "P10-06", "description": "A tiny 2D transformer adapter produces selected gradients while stems, normalizations, and base parameters remain frozen.", "status": "passed", "evidence": "TinyVisionTransformer backward test checks LoRA gradients and frozen patch_embed/norm paths."},
    {"id": "P10-07", "description": "A tiny 3D transformer adapter targets only the reviewed late transformer stage.", "status": "passed", "evidence": "GenericMONAI3DAdapter test asserts every selected path is in blocks.layers.1 and excludes patch_embed."},
    {"id": "P10-08", "description": "A tiny causal language adapter preserves frozen base weights while language LoRA and the visual-boundary component receive gradients.", "status": "passed", "evidence": "GenericHFCausalLMAdapter forward/backward test checks finite loss, LoRA gradients, boundary trainability, declarations, and audit counts."},
    {"id": "P10-09", "description": "Quantized base parameters are marked/frozen, excluded from optimizer groups, and full-base QLoRA trainability fails with a typed error.", "status": "passed", "evidence": "tests/phase_10/test_quantization_safety.py covers quantized markers, optimizer exclusion, full-base rejection, and zero-trainable rejection."},
    {"id": "P10-10", "description": "Canonical adapter-only checkpoints are CPU safetensors with provenance/config hashes and separate adapter/component files.", "status": "passed", "evidence": "Checkpoint tests inspect manifest format, namespaced adapter files, absence of base-layer files, and component round-trip behavior."},
    {"id": "P10-11", "description": "Multiple named adapters reload without ambiguity and their stored tensors remain isolated by adapter name.", "status": "passed", "evidence": "Checkpoint test round-trips vision and site adapters into fresh base models and compares the selected tensor values."},
    {"id": "P10-12", "description": "Inference merge is optional, canonical artifacts remain unmerged, and merged/unmerged outputs are equivalent within tolerance.", "status": "passed", "evidence": "compare_merged_unmerged test passes and verifies the LoRALinear remains unmerged afterward."},
    {"id": "P10-13", "description": "Adapter loading rejects wrong base model or revision rather than silently applying incompatible tensors.", "status": "passed", "evidence": "Checkpoint compatibility tests assert typed failures for wrong revision and wrong base model."},
    {"id": "P10-14", "description": "A CUDA BF16 LoRA optimizer step completes on the available development GPU with finite loss.", "status": "passed", "evidence": "Tiny CUDA smoke completed one AdamW step on cuda:0 with bfloat16 input and finite loss 0.3217633366584778."},
    {"id": "P10-15", "description": "A real 4B bitsandbytes NF4 QLoRA optimizer step runs in the protected supported-GPU environment.", "status": "not_applicable", "justification": "The workstation has CUDA but bitsandbytes and transformers are not installed, and its 8 GB development GPU is below the declared 48 GB 4B target baseline; no 4B result is fabricated."},
    {"id": "P10-16", "description": "A BF16 LoRA optimizer step runs on the declared TPU topology.", "status": "not_applicable", "justification": "torch_xla is not installed on the workstation; TPU BF16 policy and static contracts are tested without claiming TPU execution."},
    {"id": "P10-17", "description": "CUDA-trained and TPU-trained portable adapter artifacts pass cross-backend load parity tests.", "status": "not_applicable", "justification": "No torch_xla runtime or protected cross-backend fixture is available; CPU safetensors portability and wrong-base/config checks pass locally."},
    {"id": "P10-18", "description": "Distributed wrapping preserves adapter visibility and gradient reduction for the declared backends.", "status": "not_applicable", "justification": "No DDP/FSDP/XLA distributed runtime is part of this workstation acceptance run; injection-before-wrapping APIs and adapter visibility audits are implemented and locally tested."},
    {"id": "P10-19", "description": "Phase 10 validation integrates required files, behavioral checks, report schema, and non-unknown acceptance criteria.", "status": "passed", "evidence": "_check_phase_10_peft returns [] and the acceptance command runs the isolated suite plus phase validator."}
  ],
  "unresolved_issues_file": "agent/reports/phase_10/unresolved_issues.md",
  "handoff_file": "agent/reports/phase_10/next_phase_handoff.md"
}
